{
  "$schema": "../schemas/registry-source.schema.json",
  "name": "llm-plugins-fusion",
  "owner": {
    "name": "liu liang",
    "email": "lliangcoder@gmail.com",
    "url": "https://github.com/lliangcol"
  },
  "metadata": {
    "description": "A Claude Code marketplace source for the nova-plugin AI engineering workflow framework and related public workflow metadata."
  },
  "plugins": [
    {
      "source": "./nova-plugin",
      "category": "workflow",
      "tags": ["workflow", "ai-coding", "claude-code", "codex-review"],
      "metadata": {
        "trust-level": "author-verified",
        "risk-level": "medium",
        "deprecated": false,
        "last-updated": "2026-07-08",
        "maintainer": {
          "name": "liu liang",
          "email": "lliangcoder@gmail.com",
          "url": "https://github.com/lliangcol"
        },
        "compatibility": {
          "commands": "nova-plugin/commands/",
          "skills": "nova-plugin/skills/",
          "docs": "nova-plugin/docs/README.md",
          "validation": "scripts/validate-all.mjs",
          "prerequisites": "docs/marketplace/compatibility-matrix.md"
        },
        "review": {
          "trustPolicy": "docs/marketplace/trust-policy.md",
          "securityReview": "docs/marketplace/security-review-route.md",
          "releaseHygiene": "docs/releases/release-hygiene.md"
        }
      }
    }
  ]
}
